"text","emotion"
"Hah serius ini polisi kita bisa secepat itu nangani kasusnya?,","shock"
"Nggak nyangka banget, biasanya lama, ini kok langsung diusut sih?,","shock"
"Baru aja viral kemarin, sekarang udah ditangkap aja pelakunya?,","shock"
"Wah ini mengejutkan sih, ternyata bisa juga ya polisi bergerak cepat,","shock"
"Gue kira bakal mandek kayak kasus-kasus sebelumnya, ternyata lanjut juga,","shock"
"Lah kok bisa ketahuan secepat itu sih, biasanya susah banget,","shock"
"Astaga, baru liat beritanya langsung rame soal penangkapan,","shock"
"Nggak percaya kalau polisi kita bisa setegas ini, tumben banget,","shock"
"Lah yang ngelapor kok malah diproses, kaget parah,","shock"
"Baru kali ini gue liat kasus viral beneran ditindak sama aparat,","shock"
"Beneran kaget pas baca beritanya, cepet banget penanganannya,","shock"
"Tadi gue kira hoaks, ternyata beneran ditangkap juga,","shock"
"Nggak biasanya secepat ini, biasanya harus nunggu heboh dulu,","shock"
"Serius ini polisi kita? Beneran nangkep tanpa nunggu viral dulu?,","shock"
"Gue sampe baca dua kali, nggak percaya sama headline-nya,","shock"
"Biasanya kasus kayak gini diabaikan, ini malah langsung diproses,","shock"
"Bikin kaget banget, kok bisa secepat ini?,","shock"
"Kok tumben ya polisi bisa langsung gerak begini, biasanya lama,","shock"
"Baru tadi rame, sekarang udah ada konferensi pers aja,","shock"
"Kaget beneran, nggak nyangka polisi langsung turun tangan,","shock"
"Gue masih gak percaya ini beneran ditindak sama polisi secepat itu,","shock"
"Tumben banget geraknya cepet, ada angin apa nih?,","shock"
"Eh sumpah baru semalem rame, sekarang udah diproses aja,","shock"
"Lah serius? Biasanya butuh waktu berminggu-minggu buat nanggepin,","shock"
"Ini beneran gak sih? Kayak bukan polisi yang biasa gue lihat kerjanya,","shock"
"Gue kira bercanda tadi, ternyata beneran kejadian,","shock"
"Pas baca beritanya langsung bengong, gak nyangka sama sekali,","shock"
"Kok bisa ya mereka langsung bertindak? Gue shock jujur,","shock"
"Biasanya diem-diem bae, ini kok cepet amat sih?,","shock"
"Jujur kaget banget, ini polisi kita makin pro atau gimana nih,","shock"
"Gue gak nyangka akhirnya diusut juga, padahal udah pesimis,","shock"
"Sampai sekarang masih heran kok bisa secepat itu prosesnya,","shock"
"Beneran gak nyangka sama keputusan yang diambil polisi kali ini,","shock"
"Gue bahkan belum sempat update berita, udah selesai kasusnya,","shock"
"Ini semacam keajaiban, biasanya lambat banget prosesnya,","shock"
"Baru mau komentar, eh udah kelar urusannya sama polisi,","shock"
"Kaget sih, soalnya ini gak biasa banget buat aparat secepat ini,","shock"
"Baru beberapa jam viral, sekarang udah diklarifikasi polisi,","shock"
"Gue sampe nyari berita ke sumber lain, gak percaya awalnya,","shock"
"Ini kalau bukan liat sendiri beritanya, gue pasti ngira hoaks,","shock"
"Gak biasanya secepat ini sih, gue sampe mikir dua kali,","shock"
"Tiba-tiba udah ditangkap aja, padahal baru kemarin rame,","shock"
"Ini beneran kejadian atau cuma prank netizen doang?,","shock"
"Gak nyangka sama sekali, langsung diusut tanpa nunggu viral lama-lama,","shock"
"Biasanya nunggu ribut dulu baru gerak, sekarang kok beda ya?,","shock"
"Baru liat komennya pagi ini, sore udah keluar hasil penyelidikan,","shock"
"Gue kira ini bakal jadi kasus yang gak selesai lagi, ternyata lanjut,","shock"
"Shock parah, biasanya beritanya hilang gitu aja,","shock"
"Seriusan ini polisi kita? Geraknya cepat dan tepat?,","shock"
"Sampai mikir ini kerjaan netizen, eh ternyata polisi beneran yang turun,","shock"
"Kaget bener, biasanya harus demo dulu baru didengar,","shock"
"Gak masuk akal sih secepat ini, gue heran juga jujur,","shock"
"Baru kali ini rasanya bangga sama kinerja polisi,","shock"
"Pas liat headline-nya langsung mikir ini pasti editan,","shock"
"Gue sampai baca ulang dua kali buat pastiin beritanya bener,","shock"
"Ini yang nangani siapa sih? Kok beda banget kecepatannya,","shock"
"Gak biasanya polisi langsung tanggap kayak gini, kaget sih,","shock"
"Baru denger kasusnya kemarin, sekarang udah masuk proses hukum,","shock"
"Gue gak percaya sampai nanya temen, takut salah baca,","shock"
"Ternyata masih ada harapan ya buat penegakan hukum di negeri ini,","shock"
"Eh serius dong ini udah ditindak? Kirain cuma heboh di medsos doang,","shock"
"Lah baru kemarin rame di TikTok, sekarang udah ada tindakan?,","shock"
"Sumpah gak nyangka, ini cepet banget sih buat ukuran polisi,","shock"
"Tadi scroll medsos masih rame, sekarang pelakunya udah ketangkep,","shock"
"Buset, biasanya butuh petisi dulu baru gerak, ini mah langsung,","shock"
"Gue kira bakal masuk angin, ternyata malah langsung masuk proses hukum,","shock"
"Kok bisa ya seefektif ini? Kaget beneran gue,","shock"
"Beneran kejutan dari pihak kepolisian sih, gak nyangka banget,","shock"
"Ini kalau bukan viral gak mungkin secepet ini sih, tapi tetep kaget,","shock"
"Baru pertama kali liat respons secepat kilat dari polisi,","shock"
"Biasanya viral sampe 3 hari baru ditindak, ini mah baru semalem,","shock"
"Astaga baru aja lihat beritanya, kok udah diproses juga,","shock"
"Langsung ditangani? Ini kejutan terbesar minggu ini,","shock"
"Awalnya gak percaya, tapi ternyata udah ada tindakan nyata,","shock"
"Baru kali ini netizen dibuat speechless sama kinerja polisi,","shock"
"Beneran kejutan dari pihak berwenang, salut dan kaget,","shock"
"Gak percaya banget sih, biasanya lamban banget urusannya,","shock"
"Lho kok bisa langsung ditindak? Tumben banget,","shock"
"Kaget sih, ternyata gak cuma janji doang,","shock"
"Gue sempet mikir ini bakal tenggelam, ternyata enggak,","shock"
"Nggak biasanya secepat ini, ada perubahan apa nih?,","shock"
"Tadi pagi liat videonya, sorenya udah keluar tindakan hukum,","shock"
"Gue kira bakalan ribet kayak biasanya, ini malah langsung tuntas,","shock"
"Gak nyangka sama kecepatan polisi kali ini, out of the box banget,","shock"
"Apa jangan-jangan akun medsos mereka ikut monitor juga ya?,","shock"
"Bisa gitu ya geraknya, gue sampe mikir ini bukan polisi Indonesia,","shock"
"Gue kira mimpi, ternyata beneran udah ditindak,","shock"
"Heran juga, kasus lain aja butuh waktu lama, ini kok langsung,","shock"
"Fix ini paling cepet sih penanganan kasus yang pernah gue liat,","shock"
"Awalnya skeptis, tapi beneran ditindak juga akhirnya,","shock"
"Gue bacanya sambil ngucek mata, kaget beneran,","shock"
"Ini nyata? Kok bisa secepat ini? Gak kebayang sih,","shock"
"Baru kali ini gue bilang: wah keren juga aparatnya,","shock"
"Tiba-tiba aja muncul hasil penyelidikan, cepet amat,","shock"
"Pas lihat berita gue kira editan, ternyata beneran ada progres,","shock"
"Gak ada angin gak ada hujan, tau-tau udah ditangkap,","shock"
"Ini pasti banyak yang kaget juga kayak gue, serius deh,","shock"
"Seketika gue percaya kalau polisi bisa juga kok kerja cepat,","shock"
"Gue sampai mikir ada yang hack sistemnya, kok bisa secepat ini,","shock"
"Biasanya nunggu demo berjilid-jilid, ini mah auto proses,","shock"
"Wah, gak nyangka polisi bisa secepat ini tangani kasusnya,","shock"
"Serius, ini bukan berita hoaks kan? Cepet banget,","shock"
"Tadi pagi baru viral, sorenya udah ada perkembangan besar,","shock"
"Biasanya butuh waktu lama, ini malah langsung jalan lancar,","shock"
"Gue sampe mikir dua kali, ini beneran kerja polisi?,","shock"
"Eh, kok bisa ya polisi gerak secepat ini? Kaget banget,","shock"
"Baru kali ini lihat polisi cepat tanggap, biasanya lama banget,","shock"
"Ini semacam mukjizat, baru viral langsung beres,","shock"
"Pas baca beritanya, gue kaget banget, gak nyangka,","shock"
"Kok bisa ya, cuma hitungan jam langsung ada tindakan?,","shock"
"Biasanya lama banget, ini malah langsung ditindaklanjuti,","shock"
"Wah ini patut diapresiasi, keren banget polisi kali ini,","shock"
"Gue kira cuma omong kosong, ternyata beneran ada progress,","shock"
"Kaget sih, karena biasanya kasus kayak gini mangkrak lama,","shock"
"Baru pagi lihat update, sore sudah ada perkembangan signifikan,","shock"
"Wow, polisi kita makin progresif aja nih, mantap,","shock"
"Gak biasanya secepat ini, pasti ada perubahan besar di internal,","shock"
"Seriusan ini polisi kita? Kaget banget liat aksinya,","shock"
"Ini baru namanya respons cepat, bikin 'terkejut' gue,","shock"
"Biasanya lama prosesnya, ini malah cepet banget,","shock"
"Gue gak percaya dulu, sekarang baru percaya kerja polisi,","shock"
"Baru kemarin ramai, sekarang udah ada hasil penyelidikan,","shock"
"Lho kok bisa ya? Ini perubahan yang mengejutkan,","shock"
"Kaget banget sama kecepatan penanganan kasusnya,","shock"
"Eh serius? Ini sih bukan polisi biasanya deh,","shock"
"Baru kali ini gue bilang, wow, hebat juga ya polisi,","shock"
"Gue gak nyangka polisi bisa kerja secepat ini,","shock"
"Kaget pas baca update terakhir, gak nyangka beneran diproses,","shock"
"Wah ini beda banget sama biasanya, langsung ada perkembangan,","shock"
"Seriusan ini bukan hoaks? Cepet banget tindakannya,","shock"
"Biasanya berbulan-bulan, ini cuma hitungan hari doang,","shock"
"Gue sampe speechless liat kecepatan penanganan kasus,","shock"
"Wow, mantap banget polisi kita, bikin kaget aja,","shock"
"Baru pagi viral, sore udah ada pengumuman resmi,","shock"
"Gue kira cuma wacana, ternyata beneran ada progres,","shock"
"Kok bisa ya? Ini respon yang bikin 'terkejut' netizen,","shock"
"Ini polisi kita makin bagus aja kerjanya, gak nyangka,","shock"
"Baru kali ini gue puas sama kecepatan respons aparat,","shock"
"Gue gak nyangka polisi bisa secepat ini tangani masalah,","shock"
"Wah, gak nyangka polisi bisa bertindak secepat ini,","shock"
"Ini baru kejutan, polisi langsung gerak tanpa basa-basi,","shock"
"Seriusan? Baru beberapa jam viral udah ada tindakan?,","shock"
"Biasanya lama banget, ini malah langsung cepat banget,","shock"
"Gue sampai ngedobel cek, ini beneran polisi kita?,","shock"
"Kaget banget, baru kali ini lihat penanganan secepat ini,","shock"
"Wow, tanggapan polisi kali ini bikin gue speechless,","shock"
"Ini bukan biasanya ya? Kok bisa langsung cepat banget?,","shock"
"Kaget pas baca berita, gak nyangka langsung ada hasil,","shock"
"Eh serius nih? Polisi kita makin jago aja,","shock"
"Gue kira cuma janji doang, ternyata beneran ada progres,","shock"
"Langsung diproses gini, gue sampai nggak percaya,","shock"
"Baru viral, langsung ada kabar baik, wow banget,","shock"
"Wah, tanggapan ini bikin gue optimis sama polisi,","shock"
"Kaget banget polisi tanggapnya, biasanya lama bener,","shock"
"Ini respon yang bikin netizen 'terkejut' sekaligus senang,","shock"
"Polisi kita makin oke aja nih, gak nyangka,","shock"
"Sumpah, gue gak nyangka polisi bisa secepat ini,","shock"
"Baru liat update, langsung ada hasil signifikan,","shock"
"Kok bisa ya polisi langsung bergerak secepat ini?,","shock"
"Ini baru namanya pelayanan publik yang oke banget,","shock"
"Gue sampai heran, kok bisa secepat ini penanganannya,","shock"
"Baru beberapa jam aja udah ada tindakan, mantap,","shock"
"Wow, ini progress yang jarang gue liat dari polisi,","shock"
"Gue kira cuma omong kosong, ternyata kerja beneran,","shock"
"Kaget parah, penanganannya lebih cepat dari ekspektasi,","shock"
"Eh, ini sih bukan polisi biasanya deh, keren banget,","shock"
"Gue gak nyangka polisi bisa cepat tanggap kayak gini,","shock"
"Ini baru update yang bikin gue kaget sekaligus senang,","shock"
"Baru kemarin rame, sekarang udah ada tindakan nyata,","shock"
"Kaget banget lihat progres kasusnya, gak nyangka,","shock"
"Langsung ditangani, gue sampe mikir dua kali ini beneran,","shock"
"Wah, polisi makin responsif aja, keren banget,","shock"
"Biasanya lama banget, ini malah langsung tuntas cepat,","shock"
"Gue gak nyangka, ini respon paling cepat yang pernah gue lihat,","shock"
"Seriusan? Polisi kita makin oke aja kerjanya,","shock"
"Baru viral, langsung ada kabar baik, mantap banget,","shock"
"Gue sampai gak percaya liat kecepatan tindakannya,","shock"
"Ini baru berita yang bikin gue seneng sekaligus kaget,","shock"
"Kok bisa ya, polisi langsung sigap banget, gue kaget,","shock"
"Serius, ini kerja polisi atau sulap? Cepet banget!,","shock"
"Baru viral, udah langsung ada perkembangan signifikan,","shock"
"Eh, ini sih di luar dugaan gue, langsung diproses,","shock"
"Gue kira cuma angin lalu, ternyata beneran ada tindakan,","shock"
"Wow, kinerja polisi kali ini bikin gue melongo,","shock"
"Biasanya lama, ini malah secepat kilat penanganannya,","shock"
"Langsung ada hasil, gue sampe gak percaya,","shock"
"Ini baru tanggapan yang bikin netizen heboh, kaget bener,","shock"
"Polisi kita makin kece aja, gak nyangka!,","shock"
"Gue sempet ragu, tapi sekarang beneran percaya,","shock"
"Eh, ini beneran nyata? Cepet banget progresnya,","shock"
"Baru aja rame, sekarang udah ada keputusan resmi,","shock"
"Astaga, polisi kita makin responsif aja ya,","shock"
"Ini pertama kali gue lihat penanganan secepat ini,","shock"
"Kaget parah liat progresnya, gak nyangka sih,","shock"
"Wow, keren banget polisi tanggapi kasus ini,","shock"
"Biasanya berbulan-bulan, ini cuma hitungan hari doang,","shock"
"Baru kemarin viral, sekarang sudah ada penangkapan,","shock"
"Gue gak nyangka polisi bisa kerja secepat ini,","shock"
"Ini perubahan besar, gue sampe speechless,","shock"
"Kok bisa ya, tiba-tiba ada progres besar?,","shock"
"Eh, ini beneran atau cuma hoaks? Cepet banget,","shock"
"Gue baru baca update terakhir, kaget banget,","shock"
"Polisi kita makin cepat tanggap, ini kejutan!,","shock"
"Baru kemarin ramai, sekarang udah beres masalahnya,","shock"
"Ini baru respons yang patut diapresiasi,","shock"
"Wow, gak nyangka polisi tanggapnya secepat ini,","shock"
"Gue kira cuma isapan jempol, ternyata nyata,","shock"
"Langsung ada tindakan, bikin gue kaget banget,","shock"
"Serius nih? Ini polisi beneran? Gak nyangka!,","shock"
"Baru viral, udah ada perkembangan yang wow banget,","shock"
"Polisi kita makin hebat, gue sampe takjub,","shock"
"Ini baru kerja nyata, bukan cuma janji-janji,","shock"
"Wow, progresnya cepet banget, bikin kaget!,","shock"
"Gue gak nyangka polisi bisa secepat ini bergerak,","shock"
"Baru kemarin rame, sekarang sudah clear masalahnya,","shock"
"Kaget banget sama kinerja polisi kali ini,","shock"
"Eh, ini benar-benar kejutan buat gue,","shock"
